53,/title/tt1733785/?ref_=ttls_li_tt,The Bridge,154,(2011–2018),MA,60,"Crime, Mystery, Thriller",8.6,"['Sofia Helin', 'Rafael Pettersson', 'Sarah Boberg', 'Dag Malmberg']",72091,"When a body is found on the bridge between Denmark and Sweden, right on the border, Danish inspector Martin Rohde and Swedish Saga Norén have to share jurisdiction and work together to find the killer.",2011–2018)
54,/title/tt0092337/?ref_=ttls_li_tt,Dekalog,155,(1989–1990),MA,572,Drama,9.0,"['Artur Barcis', 'Olgierd Lukaszewicz', 'Olaf Lubaszenko', 'Aleksander Bardini']",26525,"Ten television drama films, each one based on one of the Ten Commandments.",1989–1990)
55,/title/tt2249364/?ref_=ttls_li_tt,Broadchurch,156,(2013–2017),MA,48,"Crime, Drama, Mystery",8.4,"['David Tennant', 'Olivia Colman', 'Jodie Whittaker', 'Andrew Buchan']",118043,"The murder of a young boy in a small coastal town brings a media frenzy, which threatens to tear the community apart.",2013–2017)
56,/title/tt6077448/?ref_=ttls_li_tt,Sacred Games,157,(2018–2019),MA,50,"Action, Crime, Drama",8.5,"['Saif Ali Khan', 'Nawazuddin Siddiqui', 'Neeraj Kabi', 'Elnaaz Norouzi']",89592,"A link in their pasts leads an honest cop to a fugitive gang boss, whose cryptic warning spurs the officer on a quest to save Mumbai from cataclysm.",2018–2019)
57,/title/tt0118276/?ref_=ttls_li_tt,Buffy the Vampire Slayer,158,(1997–2003),14,44,"Action, Drama, Fantasy",8.3,"['Sarah Michelle Gellar', 'Nicholas Brendon', 'Alyson Hannigan', 'Anthony Head']",151894,"A young woman, destined to slay vampires, demons and other infernal creatures, deals with her life fighting evil, with the help of her friends.",1997–2003)
58,/title/tt0409591/?ref_=ttls_li_tt,Naruto,159,(2002–2007),PG,24,"Animation, Action, Adventure",8.4,"['Junko Takeuchi', 'Maile Flanagan', 'Kate Higgins', 'Chie Nakamura']",110211,"Naruto Uzumaki, a mischievous adolescent ninja, struggles as he searches for recognition and dreams of becoming the Hokage, the village's leader and strongest ninja.",2002–2007)
59,/title/tt2017109/?ref_=ttls_li_tt,Banshee,160,(2013–2016),MA,60,"Action, Crime, Drama",8.4,"['Antony Starr', 'Ivana Milicevic', 'Ulrich Thomsen', 'Frankie Faison']",109469,"An ex-con assumes the identity of a murdered sheriff in the small town of Banshee, Pennsylvania, where he has some unfinished business.",2013–2016)
60,/title/tt7909970/?ref_=ttls_li_tt,Unbelievable,161,(2019),MA,385,"Crime, Drama",8.4,"['Kaitlyn Dever', 'Toni Collette', 'Merritt Wever', 'Blake Ellis']",108564,"A teenager is charged with lying about having been raped, but two detectives follow the path to the truth.",2019)
61,/title/tt9174558/?ref_=ttls_li_tt,Dopesick,162,(2021),MA,492,Drama,8.6,"['Michael Keaton', 'Peter Sarsgaard', 'Michael Stuhlbarg', 'Will Poulter']",63470,"The series takes viewers to the epicenter of America's struggle with opioid addiction, from the boardrooms of Purdue Pharma, to a distressed Virginia mining community, to the hallways of the DEA.",2021)
62,/title/tt3647998/?ref_=ttls_li_tt,Taboo,163,(2017),MA,59,"Drama, Mystery, Thriller",8.3,"['Oona Chaplin', 'Tom Hardy', 'David Hayman', 'Ruby-May Martinwood']",142531,"Adventurer James Keziah Delaney returns to London during the War of 1812 to rebuild his late father's shipping empire. However, both the government and his biggest competitor want his inheritance at any cost--even murder.",2017)
63,/title/tt2632424/?ref_=ttls_li_tt,The Originals,164,(2013–2018),14,45,"Drama, Fantasy, Horror",8.3,"['Joseph Morgan', 'Daniel Gillies', 'Claire Holt', 'Phoebe Tonkin']",140378,A family of power-hungry thousand-year-old vampires look to take back the city that they built and dominate all those who have done them wrong.,2013–2018)
64,/title/tt0458290/?ref_=ttls_li_tt,Star Wars: The Clone Wars,165,(2008–2020),PG,23,"Animation, Action, Adventure",8.4,"['Tom Kane', 'Dee Bradley Baker', 'Matt Lanter', 'James Arnold Taylor']",105918,Jedi Knights lead the Grand Army of the Republic against the droid army of the Separatists.,2008–2020)
65,/title/tt1492966/?ref_=ttls_li_tt,Louie,166,(2010–2015),MA,22,"Comedy, Drama",8.5,"['Louis C.K.', 'Hadley Delany', 'Ursula Parker', 'Pamela Adlon']",80242,"The life of Louie C.K., a divorced comedian living in New York with two kids.",2010–2015)
66,/title/tt2149175/?ref_=ttls_li_tt,The Americans,167,(2013–2018),MA,44,"Crime, Drama, Mystery",8.4,"['Keri Russell', 'Matthew Rhys', 'Keidrich Sellati', 'Holly Taylor']",103885,"At the height of the Cold War, two Russian agents pose as the average American couple, complete with family.",2013–2018)
67,/title/tt14986406/?ref_=ttls_li_tt,Bleach: Thousand-Year Blood War,168,(2022– ),MA,24,"Animation, Action, Adventure",9.0,"['Masakazu Morita', 'Johnny Yong Bosch', 'Takayuki Sugô', 'Richard Epcar']",18691,"The peace is suddenly broken when warning sirens blare through the Soul Society. Residents are disappearing without a trace and nobody knows who's behind it. Meanwhile, a darkness is approaching Ichigo and his friends in Karakura Town.",2022– )
68,/title/tt0314979/?ref_=ttls_li_tt,Battlestar Galactica,169,(2003),14,183,"Action, Adventure, Drama",8.5,"['Edward James Olmos', 'Mary McDonnell', 'Katee Sackhoff', 'Jamie Bamber']",77482,"Following the destruction of the Twelve Colonies of Kobol by the Cylons, a rag-tag fugitive fleet of the last remnants of mankind flees the pursuing Cylons while simultaneously searching for their true home: Earth.",2003)
69,/title/tt0491738/?ref_=ttls_li_tt,Psych,170,(2006–2014),PG,44,"Comedy, Crime, Mystery",8.4,"['James Roday Rodriguez', 'Dulé Hill', 'Timothy Omundson', 'Corbin Bernsen']",100934,"When a novice sleuth convinces the police he has psychic powers, he and his reluctant best friend are hired on as consultants to help solve complicated cases.",2006–2014)
70,/title/tt1844624/?ref_=ttls_li_tt,American Horror Story,171,(2011– ),MA,60,"Drama, Horror, Sci-Fi",8.0,"['Lady Gaga', 'Kathy Bates', 'Angela Bassett', 'Sarah Paulson']",326688,"An anthology series centering on different characters and locations, including a house with a murderous past, an insane asylum, a witch coven, a freak show circus, a haunted hotel, a possessed farmhouse, a cult, the apocalypse, a slasher summer camp, a bleak beach town and desert valley, and NYC.",2011– )
71,/title/tt3502248/?ref_=ttls_li_tt,Bosch,172,(2014–2021),MA,51,"Crime, Drama",8.5,"['Titus Welliver', 'Jamie Hector', 'Amy Aquino', 'Lance Reddick']",75569,An L.A.P.D. homicide detective works to solve the murder of a 13-year-old boy while standing trial in federal court for the murder of a serial killer.,2014–2021)
72,/title/tt0112159/?ref_=ttls_li_tt,Neon Genesis Evangelion,173,(1995–1996),MA,24,"Animation, Action, Drama",8.5,"['Megumi Ogata', 'Megumi Hayashibara', 'Kotono Mitsuishi', 'Spike Spencer']",75196,A teenage boy finds himself recruited as a member of an elite team of pilots by his father.,1995–1996)
73,/title/tt4270492/?ref_=ttls_li_tt,Billions,174,(2016– ),MA,60,Drama,8.4,"['Paul Giamatti', 'Damian Lewis', 'Maggie Siff', 'David Costabile']",97523,"New money means no mercy as Mike Prince takes the Axe Capital throne. Chuck Rhoades is convinced no one should have that much wealth - or power. As all the players seek out new alliances, only one thing's for certain - wealth means war.",2016– )
74,/title/tt4955642/?ref_=ttls_li_tt,The Good Place,175,(2016–2020),PG,22,"Comedy, Drama, Fantasy",8.2,"['Kristen Bell', 'William Jackson Harper', 'Jameela Jamil', ""D'Arcy Carden""]",170821,Four people and their otherworldly frienemy struggle in the afterlife to define what it means to be good.,2016–2020)
75,/title/tt2788432/?ref_=ttls_li_tt,American Crime Story,176,(2016– ),MA,42,"Biography, Crime, Drama",8.4,"['Sarah Paulson', 'Annaleigh Ashford', 'Sterling K. Brown', 'Kenneth Choi']",96729,An anthology series centered around America's most notorious crimes and criminals.,2016– )
76,/title/tt0118480/?ref_=ttls_li_tt,Stargate SG-1,177,(1997–2007),14,44,"Action, Adventure, Drama",8.4,"['Richard Dean Anderson', 'Michael Shanks', 'Amanda Tapping', 'Christopher Judge']",96744,"A secret military team, SG-1, is formed to explore other planets through the recently discovered Stargates.",1997–2007)
77,/title/tt0496424/?ref_=ttls_li_tt,30 Rock,178,(2006–2013),14,22,Comedy,8.3,"['Tina Fey', 'Alec Baldwin', 'Tracy Morgan', 'Jack McBrayer']",127190,"Liz Lemon, head writer of the sketch-comedy show ""TGS with Tracy Jordan"", must deal with an arrogant new boss and a crazy new star while trying to run a successful television show without losing her mind.",2006–2013)
78,/title/tt0421357/?ref_=ttls_li_tt,Fullmetal Alchemist,179,(2003–2004),PG,24,"Animation, Action, Adventure",8.5,"['Vic Mignogna', 'Aaron Dismuke', 'Romi Park', 'Rie Kugimiya']",73299,"When a failed alchemical ritual leaves brothers Edward and Alphonse Elric with severely damaged bodies, they begin searching for the one thing that can save them: the fabled philosopher's stone.",2003–2004)
79,/title/tt0318871/?ref_=ttls_li_tt,Berserk,180,(1997–1998),MA,23,"Animation, Action, Adventure",8.7,"['Marc Diraison', 'Nobutoshi Canna', 'Carrie Keranen', 'Kevin T. Collins']",43755,"Guts is a skilled swordsman who joins forces with a mercenary group named 'The Band of the Hawk', lead by the charismatic Griffith, and fights with them as they battle their way into the royal court.",1997–1998)
80,/title/tt0187664/?ref_=ttls_li_tt,Spaced,181,(1999–2001),14,25,"Action, Comedy",8.5,"['Simon Pegg', 'Jessica Hynes', 'Julia Deakin', 'Nick Frost']",55836,"Friends Tim and Daisy, 20-something North Londoners with uncertain futures, must pretend to be a couple to live in the only apartment they can afford.",1999–2001)
81,/title/tt12343534/?ref_=ttls_li_tt,Jujutsu Kaisen,182,(2020– ),MA,24,"Animation, Action, Adventure",8.5,"['Junya Enoki', 'Adam McArthur', 'Yûichi Nakamura', 'Yuma Uchida']",71300,A boy swallows a cursed talisman - the finger of a demon - and becomes cursed himself. He enters a shaman's school to be able to locate the demon's other body parts and thus exorcise himself.,2020– )
82,/title/tt5348176/?ref_=ttls_li_tt,Barry,183,(2018–2023),MA,30,"Action, Comedy, Crime",8.4,"['Bill Hader', 'Stephen Root', 'Sarah Goldberg', 'Anthony Carrigan']",93692,A hit man from the Midwest moves to Los Angeles and gets caught up in the city's theatre arts scene.,2018–2023)
83,/title/tt4093826/?ref_=ttls_li_tt,Twin Peaks,184,(2017),MA,60,"Crime, Drama, Horror",8.5,"['Kyle MacLachlan', 'Sheryl Lee', 'Michael Horse', 'Chrysta Bell']",70635,Picks up 25 years after the inhabitants of a quaint northwestern town are stunned when their homecoming queen is murdered.,2017)
84,/title/tt0111958/?ref_=ttls_li_tt,Father Ted,185,(1995–1998),14,25,Comedy,8.7,"['Dermot Morgan', ""Ardal O'Hanlon"", 'Frank Kelly', 'Pauline McLynn']",41803,"Three misfit priests and their housekeeper live on Craggy Island, not the peaceful and quiet part of Ireland that it seems to be.",1995–1998)
85,/title/tt1220617/?ref_=ttls_li_tt,The Inbetweeners,186,(2008–2010),14,25,Comedy,8.4,"['Simon Bird', 'James Buckley', 'Blake Harrison', 'Joe Thomas']",90488,Follows four friends and their antics during their final years of school.,2008–2010)
86,/title/tt13146488/?ref_=ttls_li_tt,Peacemaker,187,(2022– ),MA,40,"Action, Adventure, Comedy",8.3,"['John Cena', 'Danielle Brooks', 'Freddie Stroma', 'Jennifer Holland']",119331,"Picking up where The Suicide Squad (2021) left off, Peacemaker returns home after recovering from his encounter with Bloodsport - only to discover that his freedom comes at a price.",2022– )
87,/title/tt2049116/?ref_=ttls_li_tt,Gomorrah,188,(2014–2021),MA,55,"Crime, Drama, Thriller",8.7,"['Salvatore Esposito', ""Marco D'Amore"", 'Ivana Lotito', ""Cristiana Dell'Anna""]",41612,Ciro disregards tradition in his attempt to become the next boss of his crime syndicate. The internal power struggle puts him and his entire family's life at risk.,2014–2021)
88,/title/tt14452776/?ref_=ttls_li_tt,The Bear,189,(2022– ),MA,30,"Comedy, Drama",8.4,"['Jeremy Allen White', 'Ebon Moss-Bachrach', 'Ayo Edebiri', 'Molly Gordon']",90308,A young chef from the fine dining world returns to Chicago to run his family's sandwich shop.,2022– )
89,/title/tt2431438/?ref_=ttls_li_tt,Sense8,190,(2015–2018),MA,60,"Drama, Mystery, Sci-Fi",8.2,"['Bae Doona', 'Jamie Clayton', 'Tina Desai', 'Tuppence Middleton']",157695,"A group of people around the world are suddenly linked mentally, and must find a way to survive being hunted by those who see them as a threat to the world's order.",2015–2018)
90,/title/tt0374463/?ref_=ttls_li_tt,The Pacific,191,(2010),MA,530,"Action, Adventure, Drama",8.3,"['James Badge Dale', 'Joseph Mazzello', 'Jon Seda', 'Ashton Holmes']",116635,"The Pacific Theatre of World War II, as seen through the eyes of several young Marines.",2010)
91,/title/tt1637727/?ref_=ttls_li_tt,The Killing,192,(2011–2014),14,45,"Crime, Drama, Mystery",8.3,"['Mireille Enos', 'Joel Kinnaman', 'Billy Campbell', 'Liam James']",116038,"A police investigation, the saga of a grieving family, and a Seattle mayoral campaign all interlock after the body of 17-year-old Rosie Larsen is found in the trunk of a submerged car.",2011–2014)
92,/title/tt0452046/?ref_=ttls_li_tt,Criminal Minds,193,(2005– ),14,42,"Crime, Drama, Mystery",8.1,"['Kirsten Vangsness', 'Matthew Gray Gubler', 'A.J. Cook', 'Joe Mantegna']",207239,A group of criminal profilers who work for the FBI as members of its Behavioral Analysis Unit (BAU) using behavioral analysis and profiling to help investigate crimes and find the suspect known as the unsub.,2005– )
93,/title/tt8714904/?ref_=ttls_li_tt,Narcos: Mexico,194,(2018–2021),MA,50,"Crime, Drama",8.4,"['Scoot McNairy', 'José María Yazpik', 'Alejandro Edda', 'Alfonso Dosal']",87646,The rise of the Guadalajara Cartel as an American DEA agent learns the danger of targeting narcos in Mexico.,2018–2021)
94,/title/tt11337908/?ref_=ttls_li_tt,Maid,195,(2021),MA,545,Drama,8.4,"['Margaret Qualley', 'Nick Robinson', 'Rylea Nevaeh Whittet', 'Andie MacDowell']",87573,"After fleeing an abusive relationship, a young mother finds a job cleaning houses as she fights to provide for her child and build them a better future.",2021)
95,/title/tt0060028/?ref_=ttls_li_tt,Star Trek,196,(1966–1969),PG,50,"Action, Adventure, Sci-Fi",8.4,"['William Shatner', 'Leonard Nimoy', 'DeForest Kelley', 'Nichelle Nichols']",87308,"In the 23rd Century, Captain James T. Kirk and the crew of the U.S.S. Enterprise explore the galaxy and defend the United Federation of Planets.",1966–1969)
96,/title/tt0423731/?ref_=ttls_li_tt,Samurai Champloo,197,(2004–2005),MA,24,"Animation, Action, Adventure",8.6,"['Kazuya Nakai', 'Ginpei Sato', 'Ayako Kawasumi', 'Steve Blum']",51328,"Fuu, a waitress who works in a teahouse, rescues two master swordsmen, Mugen and Jin, from their execution to help her find the ""samurai who smells of sunflowers.""",2004–2005)
97,/title/tt0081834/?ref_=ttls_li_tt,Das Boot,198,(1985),MA,293,"Drama, War",8.8,"['Jürgen Prochnow', 'Herbert Grönemeyer', 'Klaus Wennemann', 'Hubertus Bengsch']",31483,A World War II German U-Boat crew have a terrifying patrol mission in the early days of the war.,1985)
98,/title/tt2234222/?ref_=ttls_li_tt,Orphan Black,199,(2013–2017),MA,44,"Drama, Sci-Fi, Thriller",8.3,"['Tatiana Maslany', 'Dylan Bruce', 'Jordan Gavaris', 'Kevin Hanchard']",113241,A streetwise hustler is pulled into a compelling conspiracy after witnessing the suicide of a girl who looks just like her.,2013–2017)
99,/title/tt2741602/?ref_=ttls_li_tt,The Blacklist,200,(2013–2023),14,43,"Crime, Drama, Mystery",8.0,"['James Spader', 'Megan Boone', 'Diego Klattenhoff', 'Ryan Eggold']",260868,"A new FBI profiler, Elizabeth Keen, has her entire life uprooted when a mysterious criminal, Raymond Reddington, who has eluded capture for decades, turns himself in and insists on speaking only to her.",2013–2023)
0,/title/tt0112130/?ref_=ttls_li_tt,Pride and Prejudice,101,(1995),PG,327,"Drama, Romance",8.8,"['Colin Firth', 'Jennifer Ehle', 'Susannah Harker', 'Julia Sawalha']",87578,"While the arrival of wealthy gentlemen sends her marriage-minded mother into a frenzy, willful and opinionated Elizabeth Bennet matches wits with haughty Mr. Darcy.",1995)
1,/title/tt0285403/?ref_=ttls_li_tt,Scrubs,102,(2001–2010),14,22,"Comedy, Drama",8.4,"['Zach Braff', 'Donald Faison', 'Sarah Chalke', 'John C. McGinley']",261625,"In the unreal world of Sacred Heart Hospital, intern John ""J.D."" Dorian learns the ways of medicine, friendship and life.",2001–2010)
2,/title/tt7221388/?ref_=ttls_li_tt,Cobra Kai,103,(2018–2023),14,30,"Action, Comedy, Drama",8.5,"['Ralph Macchio', 'William Zabka', 'Courtney Henggeler', 'Xolo Maridueña']",192975,"Decades after their 1984 All Valley Karate Tournament bout, a middle-aged Daniel LaRusso and Johnny Lawrence find themselves martial-arts rivals again.",2018–2023)
3,/title/tt1796960/?ref_=ttls_li_tt,Homeland,104,(2011–2020),MA,55,"Crime, Drama, Mystery",8.3,"['Claire Danes', 'Mandy Patinkin', 'Damian Lewis', 'Rupert Friend']",348872,A bipolar CIA operative becomes convinced a prisoner of war has been turned by al-Qaeda and is planning to carry out a terrorist attack on American soil.,2011–2020)
4,/title/tt1119644/?ref_=ttls_li_tt,Fringe,105,(2008–2013),14,46,"Drama, Mystery, Sci-Fi",8.4,"['Anna Torv', 'Joshua Jackson', 'John Noble', 'Jasika Nicole']",249161,An F.B.I. agent is forced to work with an institutionalized scientist and his son in order to rationalize a brewing storm of unexplained phenomena.,2008–2013)
5,/title/tt5834204/?ref_=ttls_li_tt,The Handmaid's Tale,106,(2017– ),MA,60,"Drama, Sci-Fi, Thriller",8.4,"['Elisabeth Moss', 'Yvonne Strahovski', 'Ann Dowd', 'O-T Fagbenle']",246318,"Set in a dystopian future, a woman is forced to live as a concubine under a fundamentalist theocratic dictatorship.",2017– )
6,/title/tt1839578/?ref_=ttls_li_tt,Person of Interest,107,(2011–2016),14,43,"Action, Crime, Drama",8.5,"['Jim Caviezel', 'Taraji P. Henson', 'Kevin Chapman', 'Michael Emerson']",180944,"An ex-CIA agent and a wealthy programmer save lives via a surveillance AI that sends them the identities of civilians involved in impending crimes. However, the details of the crimes, including the civilians' roles, are left a mystery.",2011–2016)
7,/title/tt0118421/?ref_=ttls_li_tt,Oz,108,(1997–2003),MA,55,"Crime, Drama, Thriller",8.7,"['Ernie Hudson', 'J.K. Simmons', 'Lee Tergesen', 'Dean Winters']",102103,A series chronicling the daily activities of an unusual prison facility and its criminal inhabitants.,1997–2003)
8,/title/tt0387199/?ref_=ttls_li_tt,Entourage,109,(2004–2011),MA,28,"Comedy, Drama",8.5,"['Kevin Connolly', 'Adrian Grenier', 'Kevin Dillon', 'Jerry Ferrara']",172315,Film star Vince Chase navigates the vapid terrain of Los Angeles with a close circle of friends and his trusty agent.,2004–2011)
9,/title/tt7767422/?ref_=ttls_li_tt,Sex Education,110,(2019– ),MA,45,"Comedy, Drama",8.3,"['Asa Butterfield', 'Gillian Anderson', 'Ncuti Gatwa', 'Emma Mackey']",298322,A teenage boy with a sex therapist mother teams up with a high school classmate to set up an underground sex therapy clinic at school.,2019– )
10,/title/tt3230854/?ref_=ttls_li_tt,The Expanse,111,(2015–2022),14,60,"Drama, Mystery, Sci-Fi",8.5,"['Steven Strait', 'Dominique Tipper', 'Wes Chatham', 'Shohreh Aghdashloo']",160246,"In the 24th century, a group of humans untangle a vast plot which threatens the Solar System's fragile state of detente.",2015–2022)
11,/title/tt13991232/?ref_=ttls_li_tt,1883,112,(2021–2022),MA,60,"Drama, Western",8.7,"['Sam Elliott', 'Tim McGraw', 'Faith Hill', 'Isabel May']",92302,Follows the Dutton family as they embark on a journey west.,2021–2022)
12,/title/tt0487831/?ref_=ttls_li_tt,The IT Crowd,113,(2006–2013),14,25,Comedy,8.5,"[""Chris O'Dowd"", 'Richard Ayoade', 'Katherine Parkinson', 'Matt Berry']",157540,"The comedic misadventures of Roy, Moss and their grifting supervisor Jen, a rag-tag team of IT support workers at a large corporation headed by a hotheaded yuppie.",2006–2013)
13,/title/tt7920978/?ref_=ttls_li_tt,Persona,114,(2018),MA,65,"Crime, Drama, Mystery",9.0,"['Haluk Bilginer', 'Cansu Dere', 'Metin Akdülger', 'Sebnem Bozoklu']",43219,A man diagnosed with Alzheimer's decides to punish criminals.,2018)
14,/title/tt1870479/?ref_=ttls_li_tt,The Newsroom,115,(2012–2014),MA,55,Drama,8.6,"['Jeff Daniels', 'Emily Mortimer', 'John Gallagher Jr.', 'Alison Pill']",119080,"A newsroom undergoes some changes in its workings and morals as a new team is brought in, bringing unexpected results for its existing news anchor.",2012–2014)
15,/title/tt2575988/?ref_=ttls_li_tt,Silicon Valley,116,(2014–2019),MA,28,Comedy,8.5,"['Thomas Middleditch', 'T.J. Miller', 'Josh Brener', 'Martin Starr']",156031,"Follows the struggle of Richard Hendricks, a Silicon Valley engineer trying to build his own company called Pied Piper.",2014–2019)
16,/title/tt5180504/?ref_=ttls_li_tt,The Witcher,117,(2019– ),MA,60,"Action, Adventure, Drama",8.1,"['Henry Cavill', 'Freya Allan', 'Anya Chalotra', 'Mimi Ndiweni']",517109,"Geralt of Rivia, a solitary monster hunter, struggles to find his place in a world where people often prove more wicked than beasts.",2019– )
17,/title/tt4179452/?ref_=ttls_li_tt,The Last Kingdom,118,(2015–2022),MA,60,"Action, Drama, History",8.5,"['Alexander Dreymon', 'Eliza Butterworth', 'Arnas Fedaravicius', 'Mark Rowley']",151794,"As Alfred the Great defends his kingdom from Norse invaders, Uhtred--born a Saxon but raised by Vikings--seeks to claim his ancestral birthright.",2015–2022)
18,/title/tt1910272/?ref_=ttls_li_tt,Steins;Gate,119,(2011–2015),14,24,"Animation, Comedy, Drama",8.8,"['Mamoru Miyano', 'Asami Imai', 'Kana Hanazawa', 'Ashly Burch']",66157,"After discovering time travel, a university student and his colleagues must use their knowledge of it to stop an evil organization and their diabolical plans.",2011–2015)
19,/title/tt0348914/?ref_=ttls_li_tt,Deadwood,120,(2004–2006),MA,55,"Crime, Drama, History",8.6,"['Timothy Olyphant', 'Ian McShane', 'Molly Parker', 'Brad Dourif']",110990,"A show set in the late 1800s, revolving around the characters of Deadwood, South Dakota; a town of deep corruption and crime.",2004–2006)
20,/title/tt0182576/?ref_=ttls_li_tt,Family Guy,121,(1999– ),MA,22,"Animation, Comedy",8.2,"['Seth MacFarlane', 'Alex Borstein', 'Seth Green', 'Mila Kunis']",349768,"In a wacky Rhode Island town, a dysfunctional family strives to cope with everyday life as they are thrown from one crazy scenario to another.",1999– )
21,/title/tt0285331/?ref_=ttls_li_tt,24,122,(2001–2010),14,44,"Action, Crime, Drama",8.4,"['Kiefer Sutherland', 'Mary Lynn Rajskub', 'Carlos Bernard', 'Dennis Haysbert']",190903,Counter Terrorism Agent Jack Bauer races against the clock to subvert terrorist plots and save his nation from ultimate disaster.,2001–2010)
22,/title/tt0286486/?ref_=ttls_li_tt,The Shield,123,(2002–2008),MA,47,"Crime, Drama, Thriller",8.7,"['Michael Chiklis', 'Catherine Dent', 'Walton Goggins', 'Michael Jace']",83180,Drama series following the lives and cases of dirty cop Vic Mackey and the corrupt LAPD unit under his command.,2002–2008)
23,/title/tt1758429/?ref_=ttls_li_tt,Spartacus: Gods of the Arena,124,(2011),MA,331,"Action, Adventure, Biography",8.5,"['John Hannah', 'Manu Bennett', 'Peter Mensah', 'Dustin Clare']",140724,"In the time before the arrival of Spartacus, the House of Batiatus faces many challenges from competitors, and within its own household.",2011)
24,/title/tt9140554/?ref_=ttls_li_tt,Loki,125,(2021– ),14,53,"Action, Adventure, Fantasy",8.2,"['Tom Hiddleston', 'Owen Wilson', 'Eugene Cordero', 'Gugu Mbatha-Raw']",337813,The mercurial villain Loki resumes his role as the God of Mischief in a new series that takes place after the events of “Avengers: Endgame.”,2021– )
25,/title/tt1489428/?ref_=ttls_li_tt,Justified,126,(2010–2015),MA,44,"Action, Crime, Drama",8.6,"['Timothy Olyphant', 'Nick Searcy', 'Joelle Carter', 'Jacob Pitts']",104658,"U.S. Marshal Raylan Givens is reassigned from Miami to his childhood home in the poor, rural coal mining towns of eastern Kentucky.",2010–2015)
26,/title/tt3718778/?ref_=ttls_li_tt,Over the Garden Wall,127,(2014),PG,22,"Animation, Short, Adventure",8.8,"['Elijah Wood', 'Collin Dean', 'Melanie Lynskey', 'Christopher Lloyd']",61040,Two brothers find themselves lost in a mysterious land and try to find their way home.,2014)
27,/title/tt9561862/?ref_=ttls_li_tt,"Love, Death & Robots",128,(2019– ),MA,15,"Animation, Short, Action",8.4,"['Fred Tatasciore', 'Scott Whyte', 'Nolan North', 'Noshir Dalal']",178236,"A collection of animated short stories that span various genres including science fiction, fantasy, horror and comedy.",2019– )
28,/title/tt1305826/?ref_=ttls_li_tt,Adventure Time,129,(2010–2018),PG,11,"Animation, Action, Adventure",8.6,"['John DiMaggio', 'Jeremy Shada', 'Tom Kenny', 'Hynden Walch']",100761,"A twelve-year-old boy and his best friend, a wise twenty-eight-year-old dog with magical powers, go on a series of surreal adventures in a remote future.",2010–2018)
29,/title/tt3526078/?ref_=ttls_li_tt,Schitt's Creek,130,(2015–2020),14,22,Comedy,8.5,"['Eugene Levy', ""Catherine O'Hara"", 'Dan Levy', 'Annie Murphy']",129189,"After being a victim of fraud, Johnny Rose and his family go from extremely wealthy to penniless overnight. The only asset left to them is a small, unsophisticated town: Schitt's Creek. They relocate there. Culture shock ensues.",2015–2020)
